{
  "blocking_questions": [],
  "contradictions": [],
  "evidence_candidates": [
    {
      "locators": [
        "line:231:adapters/           sqlite, filesystem, git, slack"
      ],
      "matches": [
        "slack"
      ],
      "path": "docs/reviews/2026-08-29-platform-kit-audit.md",
      "score": 1.0
    },
    {
      "locators": [
        "line:29:전문      specs/003-slack-proposal-card/evidence/3lens-review-round-21.md",
        "line:96:`/work specs/003-slack-proposal-card` 로 wave 15 를 시작한다."
      ],
      "matches": [
        "slack"
      ],
      "path": "docs/workstreams/HANDOFF_2026-08-28.md",
      "score": 1.0
    },
    {
      "locators": [
        "line:72:RUF036       src/.../slack_projection.py:813 타입 union 순서.  PR #2 를 여섯 번 막던 원인"
      ],
      "matches": [
        "slack"
      ],
      "path": "docs/workstreams/HANDOFF_2026-08-29.md",
      "score": 1.0
    },
    {
      "locators": [
        "line:24:cat specs/003-slack-proposal-card/evidence/approvals-wave-15.draft.jsonl \\",
        "line:148:2. 재freeze           Package 5 의 target 은 specs/003-slack-proposal-card/ 와 그것이",
        "line:177:wave 15 근거    specs/003-slack-proposal-card/evidence/MGC-012-P5-T04{6,7,8}.md",
        "line:179:review 원문     specs/003-slack-proposal-card/evidence/3lens-review-round-21.md",
        "line:181:승인 draft      specs/003-slack-proposal-card/evidence/approvals-wave-15.draft.jsonl"
      ],
      "matches": [
        "slack"
      ],
      "path": "docs/workstreams/HANDOFF_2026-09-02.md",
      "score": 1.0
    },
    {
      "locators": [
        "line:321:`tests/test_slack_http.py` 는 죽지 않는다. **2026-08-19 재확인에서 전 suite 가 통과했다.**",
        "line:333:$ python3 -m pytest tests/test_slack_http.py     # system 3.9",
        "line:336:$ .venv/bin/python -m pytest tests/test_slack_http.py"
      ],
      "matches": [
        "slack"
      ],
      "path": "docs/workstreams/amplai-loop-runtime-adoption/CURRENT_ITEM.md",
      "score": 1.0
    },
    {
      "locators": [
        "line:126:이식 세션은 `tests/test_slack_http.py` 실패를 \"sandbox network 정책이 바뀐 것 **(추정)**\" 으로",
        "line:130:$ python3 -m pytest tests/test_slack_http.py     # system 3.9"
      ],
      "matches": [
        "slack"
      ],
      "path": "docs/workstreams/amplai-loop-runtime-adoption/PORT-LOG.md",
      "score": 1.0
    },
    {
      "locators": [
        "line:52:Package 3 는 **production code 를 `slack_projection.py` 하나만 추가했고**, 기존 파일은"
      ],
      "matches": [
        "slack"
      ],
      "path": "docs/workstreams/messenger-governance-closure-v3/CHECKPOINTS/MGC-012-package-3-gate-2026-08-07.md",
      "score": 1.0
    },
    {
      "locators": [
        "line:18:- `src/amplai_foundry/governance/slack_projection.py` (신규)",
        "line:19:- `tests/test_slack_projection.py` (신규)",
        "line:21:`forbidden_paths`(`events.py`, `projections.py`, `slack.py`, `pyproject.toml`)는 건드리지",
        "line:108:| `python -m pytest tests/test_slack_projection.py` | 72 passed |",
        "line:112:| `python -m mypy tests/test_slack_projection.py` | 통과 |",
        "line:136:- `persisted_code_suffix` 이름과 허용 문자 집합이 `contracts/slack-transport.md` 에 없다."
      ],
      "matches": [
        "slack"
      ],
      "path": "docs/workstreams/messenger-governance-closure-v3/CHECKPOINTS/MGC-012-package-3-wave-1-review-2026-08-05.md",
      "score": 1.0
    },
    {
      "locators": [
        "line:20:- `build_slack_marker` 를 `try` 밖으로 뺐다. 안에 있으면 우리 결함이 `transport_...` 로 기록돼 transport 구현자 탓이 된다 (failure #5)",
        "line:22:- `_raise_for_failure` 가 terminal 판정을 `raise_for_slack_failure` 에 위임한다. 두 벌이던 분류 규칙이 하나가 됐고 T001 test 가 도는 쪽이 죽은 copy 가 아니게 됐다 (regression A2)"
      ],
      "matches": [
        "slack"
      ],
      "path": "docs/workstreams/messenger-governance-closure-v3/CHECKPOINTS/MGC-012-package-3-wave-2-review-2026-08-05.md",
      "score": 1.0
    },
    {
      "locators": [
        "line:47:- M21·M22 (`read_slack_marker` 의 개별 str guard) 가 mutation 에서 살아남는다. 잘못된 type 의"
      ],
      "matches": [
        "slack"
      ],
      "path": "docs/workstreams/messenger-governance-closure-v3/CHECKPOINTS/MGC-012-package-3-wave-3-review-2026-08-05.md",
      "score": 1.0
    },
    {
      "locators": [
        "line:24:dependency 검사를 위해 `slack_projection.py` 를 **runtime 에 disk 에서 읽어** `ast.parse`",
        "line:45:없었다. HEAD 전수 grep 결과 그 문자열은 `events.py:2852`, `contracts/slack-transport.md`,",
        "line:101:(`contracts/slack-transport.md` C-2, D-023 마지막 문단) 는 처음부터 두 조건을 정확히 쓰고",
        "line:162:| `python -m pytest tests/test_slack_projection.py` | 188 passed |"
      ],
      "matches": [
        "slack"
      ],
      "path": "docs/workstreams/messenger-governance-closure-v3/CHECKPOINTS/MGC-012-package-3-wave-4-review-2026-08-07.md",
      "score": 1.0
    },
    {
      "locators": [
        "line:52:`slack_projection.py` 를 mutate 해 기존 test 가 여전히 죽는 것을 8종으로 확인했다.",
        "line:67:- **`classify_slack_failure` 의 \"규칙 순서가 우선순위\" 서술은 동작으로 관측되지 않는다.**"
      ],
      "matches": [
        "slack"
      ],
      "path": "docs/workstreams/messenger-governance-closure-v3/CHECKPOINTS/MGC-012-package-4-wave-5-gate-2026-08-08.md",
      "score": 1.0
    },
    {
      "locators": [
        "line:36:`classify_slack_failure` 의 설계 전제를 정면으로 깼다. 그 함수 주석이 \"code 없는 HTTP",
        "line:43:`_slack_error_code` 가 그 조건을 요구하도록 고쳤다.",
        "line:101:- **`not_a_slack_envelope` 표지가 고정되지 않았다.** 진단 문자열이 아니라 append-only",
        "line:110:- **`classify_slack_failure` 의 \"규칙 순서가 우선순위\" 서술은 동작으로 관측되지 않는다.**",
        "line:123:$ cd <worktree> && .venv/bin/python -c \"import ...slack_http as m; print(m.__file__)\"",
        "line:124:/Users/pinesky/workspace/amplai-foundry/src/amplai_foundry/governance/slack_http.py"
      ],
      "matches": [
        "slack"
      ],
      "path": "docs/workstreams/messenger-governance-closure-v3/CHECKPOINTS/MGC-012-package-4-wave-5-review-2026-08-08.md",
      "score": 1.0
    },
    {
      "locators": [
        "line:19:`src/amplai_foundry/governance/slack_http.py`와 `tests/test_slack_http.py`에 한정됐다."
      ],
      "matches": [
        "slack"
      ],
      "path": "docs/workstreams/messenger-governance-closure-v3/CHECKPOINTS/MGC-012-package-4-wave-6r-gate-2026-08-12.md",
      "score": 1.0
    },
    {
      "locators": [
        "line:7:- Active feature pointer: `.specify/feature.json` → `specs/003-slack-proposal-card`",
        "line:33:기록: `specs/003-slack-proposal-card/evidence/3lens-review-round-13.md`",
        "line:37:| `F-1` | **P1** | `slack_http.py:445`, `:471` | **bot token 이 traceback 에 샌다.** `read_history`·`delete_message` 가 `SlackTransportError` 를 sanitize 하지 않는다. real",
        "line:42:| `F-2` | Blocking-P2 | `slack_http.py:544` | `_clear_exception_frames` 무방비 |",
        "line:93:- `specs/003-slack-proposal-card/evidence/`"
      ],
      "matches": [
        "slack"
      ],
      "path": "docs/workstreams/messenger-governance-closure-v3/CONTEXT_PACK.md",
      "score": 1.0
    },
    {
      "locators": [
        "line:46:- Package 5 — Slack Proposal Cards (`specs/003-slack-proposal-card`, feature `MGC-012-P5`):",
        "line:82:- **2026-08-25 round 17 완료.** 기록은 `specs/003-slack-proposal-card/evidence/3lens-review-round-17.md`",
        "line:88:중 **7이 닫혔다.** 기록은 `specs/003-slack-proposal-card/evidence/3lens-review-round-18.md`",
        "line:94:`specs/003-slack-proposal-card/evidence/3lens-review-round-19.md`",
        "line:99:`specs/003-slack-proposal-card/evidence/3lens-review-round-20.md`",
        "line:104:`specs/003-slack-proposal-card/evidence/3lens-review-round-21.md`"
      ],
      "matches": [
        "slack"
      ],
      "path": "docs/workstreams/messenger-governance-closure-v3/CURRENT_ITEM.md",
      "score": 1.0
    },
    {
      "locators": [
        "line:107:- Source: https://docs.slack.dev/interactivity/handling-user-interaction/",
        "line:119:- Source: MGC-012 Package 2 구현 중 발견, `tests/test_slack_ack_boundary.py`",
        "line:200:`specs/002-mgc-012-package-4-slack-reference-e2e/`를 쓴다. 아래 원문은 기록으로",
        "line:205:2. **디렉터리는 `specs/001-mgc-012-slack-reference-adapter/`다.** `001`은",
        "line:342:class 이름을 `transport_{name}`으로 넣는다. 둘 다 없으면 `no_slack_code`다. terminal",
        "line:353:사용자가 첫째를 골랐다. 반영 위치는 `contracts/slack-transport.md` C-2·C-3.1과"
      ],
      "matches": [
        "slack"
      ],
      "path": "docs/workstreams/messenger-governance-closure-v3/DECISIONS.md",
      "score": 1.0
    },
    {
      "locators": [
        "line:31:- Subagent Review: MGC-012 Package 5 (`specs/003-slack-proposal-card`) — **미완**. round 2–8은",
        "line:45:Wave 6R 뒤 `.specify/feature.json`이 `specs/003-slack-proposal-card`로 옮겨갔다. Package 5는",
        "line:53:`governance/decisions.py`, `events.py`, `review_cards.py`, `slack_cards.py` 네 파일이",
        "line:59:`slack_cards.py`의 import block(I001)을, `ruff format`이 `review_cards.py`의 호출 하나를",
        "line:68:round 10은 **FAIL**이다. `specs/003-slack-proposal-card/evidence/3lens-review.md`가 기록이다.",
        "line:76:mutation 36종 중 12 killed / 24 survived. kill rate 33%다. `slack_cards.py`는 14종 중 4종만,"
      ],
      "matches": [
        "slack"
      ],
      "path": "docs/workstreams/messenger-governance-closure-v3/STATUS.md",
      "score": 1.0
    },
    {
      "locators": [
        "line:3:**Feature**: `001-mgc-012-slack-reference-adapter` | **Date**: 2026-08-03",
        "line:106:`destination_ref` 는 `provider:slack:{channel_digest}` 형식을 그대로 받는다. destination 이",
        "line:133:| `channel` 이 공백뿐이거나 보이지 않는 문자를 포함 | receipt 가 `slack::{ts}` 가 되고 전송 대상이 없다 |",
        "line:154:| transport 성공 | `\"slack:{channel}:{ts}\"` 반환 |",
        "line:200:| 이 event 의 marker (`event_id` 일치 + `destination_ref` 일치 + `payload_digest` 일치) | `\"slack:{channel}:{ts}\"` |",
        "line:265:`slack:{channel}:{ts}` 로 만든다."
      ],
      "matches": [
        "slack"
      ],